{
  "schemaVersion": 2,
  "initialWorld": {
    "schemaVersion": 2,
    "seed": 0,
    "tick": 0,
    "nextEntityId": 1,
    "nextConnectionId": 1,
    "regionId": "nec",
    "difficulty": "apprentice",
    "assisted": false,
    "fixtures": [],
    "entities": [],
    "connections": [],
    "sim": null,
    "extensions": {}
  },
  "firstSeq": 0,
  "entries": [],
  "endTick": 0
}
