{
  "schemaVersion": 2,
  "initialWorld": {
    "schemaVersion": 2,
    "seed": 7,
    "tick": 1000,
    "nextEntityId": 2,
    "nextConnectionId": 1,
    "regionId": "nec",
    "difficulty": "apprentice",
    "assisted": false,
    "fixtures": [
      {
        "id": "bench",
        "ref": {
          "id": "prop.bench",
          "version": 1
        },
        "transform": {
          "positionMm": {
            "x": 700,
            "y": -1200,
            "z": 80
          },
          "orientationMdeg": {
            "yaw": 0,
            "pitch": 0,
            "roll": 0
          }
        },
        "extensions": {}
      }
    ],
    "entities": [
      {
        "id": 1,
        "ref": {
          "id": "battery.ferrovane-12v-7ah",
          "version": 1
        },
        "transform": {
          "positionMm": {
            "x": 800,
            "y": -300,
            "z": 200
          },
          "orientationMdeg": {
            "yaw": 0,
            "pitch": 0,
            "roll": 0
          }
        },
        "state": {},
        "sim": {
          "stateOfCharge": 0.5
        },
        "extensions": {}
      }
    ],
    "connections": [],
    "sim": null,
    "extensions": {}
  },
  "firstSeq": 7,
  "entries": [
    {
      "seq": 7,
      "tick": 1000,
      "id": "entity.place",
      "args": {
        "ref": {
          "id": "switch.tessaline-spst-toggle",
          "version": 1
        },
        "positionMm": {
          "x": 1100,
          "y": -300,
          "z": 200
        },
        "orientationMdeg": {
          "yaw": 0,
          "pitch": 0,
          "roll": 0
        }
      }
    },
    {
      "seq": 8,
      "tick": 1000,
      "id": "entity.move",
      "args": {
        "id": 2,
        "positionMm": {
          "x": 1150,
          "y": -300,
          "z": 200
        }
      }
    },
    {
      "seq": 9,
      "tick": 1000,
      "id": "edit.undo",
      "args": {}
    }
  ],
  "endTick": 1000
}
